{
  "$schema": "../../schemas/parity-fixture.schema.json",
  "schemaVersion": "1.0.0",
  "fixtureId": "metadata-007.qgis-oapif-peer",
  "title": "QGIS 3.44.12 native authenticated OAPIF compatibility with project records",
  "fixtureType": "service",
  "source": {
    "kind": "upstream",
    "description": "Version-pinned headless PyQGIS uses QGIS's native OAPIF provider against the real shared-auth and project-scoped Records route over loopback HTTP.",
    "url": "https://docs.qgis.org/3.44/en/docs/user_manual/working_with_ogc/ogc_client_support.html",
    "version": "3.44.12-Solothurn"
  },
  "license": {
    "spdxId": "CC0-1.0",
    "redistributable": true
  },
  "sensitivity": "public",
  "artifacts": [
    {
      "name": "check-qgis-records-peer.py",
      "mediaType": "text/x-python",
      "encoding": "path",
      "value": "scripts/check-qgis-records-peer.py",
      "sha256": "7b8a0064096b66883eaf6911bc477a0192c0431116bc47ab77faa53cfedaef7e"
    },
    {
      "name": "check-qgis-records-peer.mjs",
      "mediaType": "text/javascript",
      "encoding": "path",
      "value": "scripts/check-qgis-records-peer.mjs",
      "sha256": "e2c57bd8923be5381a3ea7751d558b805df0b56c46f441265bcc23e59ac4d495"
    },
    {
      "name": "metadata-007-qgis-oapif-peer.json",
      "mediaType": "application/json",
      "encoding": "path",
      "value": "parity/reports/metadata-007-qgis-oapif-peer.json",
      "sha256": "3b8203a895cd22777e3843fb7a3263c10d6ded0fcd66d1773540ca1ef6401e4e"
    }
  ],
  "expectedOutcomes": [
    {
      "rowId": "geonode.metadata-management",
      "assertion": "QGIS is denied without shared authority, then discovers the resources collection and reads the governed record through the real application route."
    },
    {
      "rowId": "openlayers.sources-protocols",
      "assertion": "The native QGIS OAPIF provider reconstructs the polygon and forwards a view restriction as an OAPIF bbox query without creating a conformance claim."
    }
  ],
  "constraints": {
    "offline": true,
    "containsPersonalData": false,
    "requiresCredentials": false
  }
}
